{
  "schemaVersion": "1.0.0",
  "studyId": "MEZ-HERO-FIRST-VIEWPORT-03",
  "exportedAt": "2026-07-21T00:11:43.015Z",
  "complete": true,
  "productionAuthority": false,
  "sourceExpressionApproved": false,
  "decisions": {
    "overallDirection": {
      "decision": "approve",
      "note": "We're definitely going in the right direction. I think this is much better. There are obviously a few little things. I don't know what order and when you want to do this, but:\n- Typography looks good.\n- Layout looks good.\n- I think the buttons are good.\n- Maybe the button color and effects could be improved.\nThe core fundamentals of the button are good. Can we make it potentially better, like a 3D button, with a stroke, a little gradient, and a little glow drop shadow, maybe for primary buttons? I think the overall direction is getting there. There are obviously a lot of little things we'll change, like maybe the card designs. We'll do a few tweaks, but that can be its own thing that we go into whenever you want to decide we do that.\nFor all the little elements, I still want to build that out as a full component suite for the products. We lock in:\n- the card design\n- the disc design\n- the sphere design\n- the wings design\nWe talk about:\n- when we use what\n- where it's used in a card\n- how it's used in a bundle\n- how it's used as an upsell\n- how it's used in an email\n- how it's used in an ad creative\n- how it's used in a video\n- when to choose this static\n- when to choose the animated one\nIt's so much deeper to go into - and obviously know we're just getting started"
    },
    "messageHierarchy": {
      "decision": "approve",
      "note": "Okay, yeah, I think the center line does look good. I think that's what you mean, right?"
    },
    "cardStackComposition": {
      "decision": "approve",
      "note": "Yes, the five card stocks do look good. I think one thing is the Context Engine: we need to apply and create a whole new gradient.\n\nAgain, that goes to my first point: we need to systemize the animated gradients and stuff because the current system we have is fucking amazing. For the AI Ads System, AI OS, Claude Code OS, and Organic Content OS, the animated gradients we have are really good, and we need to systemize that. Now, the thing is, Claude made it."
    },
    "animationUse": {
      "decision": "approve",
      "note": "One thing is the texture stuff. We need to figure it out and systemize it, like I've been saying, including how we rebuild new ones and how it all works. \n\n---\n\nHere's the whole thing, start to finish.\n\n## What it is\n\nEvery animated surface on that board is the **same one engine** drawing into a different shape. There is no library of card components. There is a single WebGL fragment shader, and a \"shape\" number tells it whether to paint a disc, a sphere, a rounded rectangle (the trading card and the pill), or the wings. One shader, four masks. That is why the system feels coherent: the card, the icon and the hero are literally the same code, not four things built to look alike.\n\n## The core idea (the ethos)\n\n**A gradient is data, not a picture.** A core is four colours, each with a position and a weight, plus one dark shading colour. That is the whole thing. Once a core is described that way, it stops being a 200KB image you have to ship and becomes four hex values you can put in a JSON file. New gradient means a one-line edit, and every treatment updates at once.\n\nThe visual philosophy underneath it is **\"one chassis, many cores.\"** The geometry, the light and the mark never change. Only the colour moves. So the system's honesty test is section 03 of the board: same disc, same shading, same wings, swap only the gradient. If it holds there, it holds everywhere.\n\nTwo craft details do most of the work:\n- **Colour is mixed in linear space, not sRGB.** Mixing raw sRGB goes muddy grey through the middle, which is why most gradients look cheap. This one converts to linear, mixes, converts back.\n- **The colours drift on mismatched orbits and are sampled through a warped coordinate.** That warp is what makes it churn like liquid instead of just rotating.\n\n## How a gradient gets ingested\n\nThis is the part you rebuild with any new gradient. A Python script (`build.py`) does it once, offline:\n\n1. Downsample the source gradient PNG to 160×160.\n2. Run **k-means (k=5)** over the pixels with a **fixed seed**. Five colour clusters fall out.\n3. The **darkest** cluster becomes the shading colour.\n4. The **other four** become the moving anchors. Crucially, each anchor keeps *where* it lived in the source (a colour that was top-right stays top-right) and *how much* of the image it was (an accent stays a small accent instead of averaging away).\n5. Write those numbers out.\n\nThe fixed seed matters more than it looks: it means two rebuilds produce identical palettes, so you can compare gradients without them shifting under you. That is the entire ingestion system. Point it at a new PNG, get a new core.\n\n## The files\n\n```\nbuild.py                    the ingestion + generator (Python)\norb-template.html           hand-edited source · one orb\nexpressions-template.html   hand-edited source · the whole board\npalettes.json               the extracted colour data\n  ↓ run build.py\nindex.html                  GENERATED · the board you're looking at\norbs/<ID>.html              GENERATED · standalone orbs\n```\n\nThe one rule: **you only ever edit the two `*-template.html` files.** Everything else is generated and gets overwritten. Want to change how every core looks? Edit the template, rerun the script. Want to fix one gradient's colours by hand? Edit `palettes.json`, rerun. Never touch `index.html` directly, your changes vanish on the next build.\n\n## The one clever bit of engineering\n\nThe board has 53 live surfaces. The obvious way (one WebGL canvas each) breaks, because browsers only allow about 16 and silently kill the rest. So instead there is **one** offscreen WebGL context. It renders a surface, then copies that image into that surface's own cheap 2D canvas. Every card shares a single GPU engine and just takes a stamp of it. That is the trick that lets 53 fluid gradients run on one page without melting the machine.\n\n## How to rebuild it with a new gradient\n\nDrop your new gradient PNG in the source folder, add its ID to the list, run `python3 build.py`. The script extracts the palette, and every treatment (disc, sphere, card, pill, favicon) renders in the new colour automatically. No shader edits, no new components.\n\nThe one honest caveat: this **approximates** the source gradient, it doesn't reproduce it pixel-for-pixel. You're trading exactness for the core becoming four editable numbers. If you ever need an exact match to the Figma swatch, use the flat static image instead.\n\n---\n\nEverything above is written up in full in the [BRIEF-living-core.md](departments/cmo/brand-library/brands/mez-systems/governance/BRIEF-living-core.md) I just made, and the deep version with every tuning constant is in the [SKILL file](departments/cmo/brand-library/components/play-orb/SKILL-play-orb-CLAUDE-CODE.md). Want me to save this explanation as a short standalone README next to the component so it travels with the code?"
    },
    "productFamilyRead": {
      "decision": "approve",
      "note": ""
    },
    "mobileOpening": {
      "decision": "edit",
      "note": "The design and layout of the mobile probably need tweaking, including whether we just do three cards from mobile or figure out a better way to show five cards."
    }
  },
  "overallNote": ""
}
